{
  "txn": {
    "uuid": "018fd849-2a40-7abc-8a45-111111111111",
    "group": {
      "org": "jade-tipi-org",
      "grp": "dev"
    },
    "client": "kli",
    "user": "0000-0002-1825-0097"
  },
  "uuid": "018fd849-2a44-7999-8d44-dddddddddd0d",
  "collection": "typ",
  "action": "update",
  "data": {
    "id": "018fd849-2a43-7333-8c03-cccccccccccc~jade-tipi-org~dev~typ~plate_96",
    "operation": "add_property",
    "property_id": "018fd849-2a42-7222-8b02-bbbbbbbbbbbb~jade-tipi-org~dev~ppy~volume",
    "required": false
  }
}
