{
  "txn": {
    "uuid": "018fd849-2a40-7abc-8a45-111111111111",
    "group": {
      "org": "jade-tipi-org",
      "grp": "dev"
    },
    "client": "kli",
    "user": "0000-0002-1825-0097"
  },
  "uuid": "018fd849-2a45-7555-8e05-eeeeeeeeeeee",
  "collection": "ent",
  "action": "create",
  "data": {
    "id": "jade-tipi-org~dev~018fd849-2a45-7555-8e05-eeeeeeeeeeee~ent~plate_a",
    "type_id": "jade-tipi-org~dev~018fd849-2a43-7333-8c03-cccccccccccc~typ~plate_96",
    "properties": {},
    "links": {}
  }
}
