{
  "txn": {
    "uuid": "018fd849-2a40-7abc-8a45-111111111111",
    "group": {
      "org": "jade-tipi-org",
      "grp": "dev"
    },
    "client": "kli",
    "user": "0000-0002-1825-0097"
  },
  "uuid": "018fd849-2a40-7def-8b56-222222222222",
  "collection": "txn",
  "action": "open",
  "data": {
    "description": "importing plate barcodes"
  }
}
