{
  "txn": {
    "uuid": "018fd849-2a40-7abc-8a45-111111111111",
    "group": {
      "org": "jade-tipi-org",
      "grp": "dev"
    },
    "client": "kli",
    "user": "0000-0002-1825-0097"
  },
  "uuid": "018fd849-2a41-7111-8a01-aaaaaaaaaaaa",
  "collection": "ppy",
  "action": "create",
  "data": {
    "kind": "definition",
    "id": "018fd849-2a41-7111-8a01-aaaaaaaaaaaa~jade-tipi-org~dev~ppy~barcode",
    "name": "barcode",
    "value_schema": {
      "type": "object",
      "required": [
        "text"
      ],
      "properties": {
        "text": {
          "type": "string"
        }
      }
    }
  }
}
