{
  "txn": {
    "uuid": "018fd849-2a40-7abc-8a45-111111111111",
    "group": {
      "org": "jade-tipi-org",
      "grp": "dev"
    },
    "client": "kli",
    "user": "0000-0002-1825-0097"
  },
  "uuid": "018fd849-3c10-7111-8a01-161616161616",
  "collection": "typ",
  "action": "create",
  "data": {
    "kind": "procedure_type",
    "id": "018fd849-3c10-7111-8a01-161616161616~jade-tipi-org~dev~typ~dna_pooling",
    "name": "dna_pooling",
    "description": "pool DNA samples into library pools, recording each input volume"
  }
}
