{
  "txn": {
    "uuid": "018fd849-2a40-7abc-8a45-111111111111",
    "group": {
      "org": "jade-tipi-org",
      "grp": "dev"
    },
    "client": "kli",
    "user": "0000-0002-1825-0097"
  },
  "uuid": "018fd849-3c14-7555-8a05-1a1a1a1a1a1a",
  "collection": "lnk",
  "action": "create",
  "data": {
    "id": "018fd849-3c14-7555-8a05-1a1a1a1a1a1a~jade-tipi-org~dev~lnk~pool_batch_7_sample_a",
    "type_id": "018fd849-3c13-7444-8a04-191919191919~jade-tipi-org~dev~typ~task_input",
    "left": "018fd849-3c12-7333-8a03-181818181818~jade-tipi-org~dev~tsk~pool_batch_7",
    "right": "018fd849-3c20-7aaa-8a0a-a1a1a1a1a1a1~jade-tipi-org~dev~ent~sample_a"
  }
}
