{
  "txn": {
    "uuid": "018fd849-2a40-7abc-8a45-111111111111",
    "group": {
      "org": "jade-tipi-org",
      "grp": "dev"
    },
    "client": "kli",
    "user": "0000-0002-1825-0097"
  },
  "uuid": "018fd849-3d02-7222-8a02-242424242424",
  "collection": "ppy",
  "action": "create",
  "data": {
    "kind": "definition",
    "id": "018fd849-3d02-7222-8a02-242424242424~jade-tipi-org~dev~ppy~retrieval_url",
    "name": "retrieval_url",
    "value_schema": {
      "type": "object",
      "required": ["url"],
      "properties": {
        "url": {
          "type": "string"
        }
      }
    }
  }
}
