{
  "txn": {
    "uuid": "018fd849-2a40-7abc-8a45-111111111111",
    "group": {
      "org": "jade-tipi-org",
      "grp": "dev"
    },
    "client": "kli",
    "user": "0000-0002-1825-0097"
  },
  "uuid": "018fd849-2a4a-7aaa-8b0a-bbbbbbbbbbbb",
  "collection": "lnk",
  "action": "create",
  "data": {
    "id": "018fd849-2a4a-7aaa-8b0a-bbbbbbbbbbbb~jade-tipi-org~dev~lnk~plate_b1_sample_x1",
    "type_id": "018fd849-2a49-7999-8a09-aaaaaaaaaaab~jade-tipi-org~dev~typ~contents",
    "left": "018fd849-2a47-7777-8f01-aaaaaaaaaaaa~jade-tipi-org~dev~loc~plate_b1",
    "right": "018fd849-2a45-7555-8e05-eeeeeeeeeeee~jade-tipi-org~dev~ent~sample_x1",
    "properties": {
      "position": {
        "kind": "plate_well",
        "label": "A1",
        "row": "A",
        "column": 1
      }
    }
  }
}
