{
  "txn": {
    "uuid": "018fd849-2a40-7abc-8a45-111111111111",
    "group": {
      "org": "jade-tipi-org",
      "grp": "dev"
    },
    "client": "kli",
    "user": "0000-0002-1825-0097"
  },
  "uuid": "018fd849-2a46-7666-8f06-ffffffffffff",
  "collection": "ppy",
  "action": "create",
  "data": {
    "kind": "assignment",
    "object_collection": "ent",
    "object_id": "018fd849-2a45-7555-8e05-eeeeeeeeeeee~jade-tipi-org~dev~ent~plate_a",
    "property_id": "018fd849-2a41-7111-8a01-aaaaaaaaaaaa~jade-tipi-org~dev~ppy~barcode",
    "value": {
      "text": "barcode-1"
    }
  }
}
