{
  "txn": {
    "uuid": "018fd849-2a40-7abc-8a45-111111111111",
    "group": {
      "org": "jade-tipi-org",
      "grp": "dev"
    },
    "client": "kli",
    "user": "0000-0002-1825-0097"
  },
  "uuid": "018fd849-2a47-7777-8a07-aaaaaaaaaaab",
  "collection": "ppy",
  "action": "create",
  "data": {
    "kind": "assignment",
    "object_collection": "ent",
    "object_id": "018fd849-2a45-7555-8e05-eeeeeeeeeeee~jade-tipi-org~dev~ent~plate_a",
    "property_id": "018fd849-2a42-7222-8b02-bbbbbbbbbbbb~jade-tipi-org~dev~ppy~volume",
    "value": {
      "number": 10,
      "unit_id": "jade-tipi-org~dev~liter~milli~ml~SI"
    }
  }
}
