{
  "txn": {
    "uuid": "018fd849-2a40-7abc-8a45-111111111111",
    "group": {
      "org": "jade-tipi-org",
      "grp": "dev"
    },
    "client": "kli",
    "user": "0000-0002-1825-0097"
  },
  "uuid": "018fd849-2a4d-7d0d-8d0d-cccccccccccc",
  "collection": "grp",
  "action": "create",
  "data": {
    "id": "018fd849-2a4d-7d0d-8d0d-cccccccccccc~jade-tipi-org~dev~grp~analytics",
    "name": "analytics",
    "description": "analytics team",
    "permissions": {
      "018fd849-2a4d-7d0d-8d0d-aaaaaaaaaaaa~jade-tipi-org~dev~grp~lab_ops": "rw",
      "018fd849-2a4d-7d0d-8d0d-bbbbbbbbbbbb~jade-tipi-org~dev~grp~viewers": "r"
    }
  }
}
