{
  "txn": {
    "uuid": "018fd849-2a40-7abc-8a45-111111111111",
    "group": {
      "org": "jade-tipi-org",
      "grp": "dev"
    },
    "client": "kli",
    "user": "0000-0002-1825-0097"
  },
  "uuid": "018fd849-3d05-7555-8a05-272727272727",
  "collection": "ppy",
  "action": "create",
  "data": {
    "kind": "assignment",
    "object_collection": "fil",
    "object_id": "018fd849-3d04-7444-8a04-262626262626~jade-tipi-org~dev~fil~run42_r1_fastq",
    "property_id": "018fd849-3d02-7222-8a02-242424242424~jade-tipi-org~dev~ppy~retrieval_url",
    "value": {
      "url": "https://data.example.org/run42/r1.fastq"
    }
  }
}
