{
  "txn": {
    "uuid": "018fd849-2a40-7abc-8a45-111111111111",
    "group": {
      "org": "jade-tipi-org",
      "grp": "dev"
    },
    "client": "kli",
    "user": "0000-0002-1825-0097"
  },
  "uuid": "018fd849-3c18-7999-8a09-222222222222",
  "collection": "typ",
  "action": "create",
  "data": {
    "kind": "link_type",
    "id": "jade-tipi-org~dev~018fd849-3c18-7999-8a09-222222222222~typ~produced_by",
    "name": "produced_by",
    "description": "an output ent and the performed procedure that created it",
    "left_role": "output",
    "right_role": "procedure",
    "left_to_right_label": "produced_by",
    "right_to_left_label": "produced",
    "allowed_left_collections": ["ent", "fil"],
    "allowed_right_collections": ["prc"]
  }
}
