{
  "txn": {
    "uuid": "018fd849-2a40-7abc-8a45-111111111111",
    "group": {
      "org": "jade-tipi-org",
      "grp": "dev"
    },
    "client": "kli",
    "user": "0000-0002-1825-0097"
  },
  "uuid": "018fd849-2a47-7777-8f01-aaaaaaaaaaaa",
  "collection": "loc",
  "action": "create",
  "data": {
    "id": "018fd849-2a47-7777-8f01-aaaaaaaaaaaa~jade-tipi-org~dev~loc~freezer_a",
    "properties": {
      "name": "freezer_a",
      "description": "minus-80 freezer in room 110"
    },
    "links": {}
  }
}
